{"$schema":"https://json-schema.org/draft/2020-12/schema","$id":"https://schemas.event-driven-commerce.test/events/payment-completed-v1.schema.json","title":"PaymentCompletedV1","type":"object","additionalProperties":false,"required":["eventId","eventType","eventVersion","aggregateId","correlationId","causationId","occurredAt","payload"],"properties":{"eventId":{"type":"string","format":"uuid"},"eventType":{"const":"PaymentCompletedV1"},"eventVersion":{"const":1},"aggregateId":{"type":"string","format":"uuid"},"correlationId":{"type":"string","format":"uuid"},"causationId":{"type":"string","format":"uuid"},"occurredAt":{"type":"string","format":"date-time"},"payload":{"type":"object","additionalProperties":false,"required":["paymentId","orderId","amount","currency","providerReference","completedAt"],"properties":{"paymentId":{"type":"string","format":"uuid"},"orderId":{"type":"string","format":"uuid"},"amount":{"type":"number","minimum":0},"currency":{"type":"string","pattern":"^[A-Z]{3}$"},"providerReference":{"type":"string","pattern":"^[A-Za-z0-9_-]{8,120}$"},"completedAt":{"type":"string","format":"date-time"}}}}}
