{"eventId":"61000000-0000-4000-8000-000000000001","eventType":"PaymentCompletedV1","eventVersion":1,"aggregateId":"62000000-0000-4000-8000-000000000001","correlationId":"63000000-0000-4000-8000-000000000001","causationId":"64000000-0000-4000-8000-000000000001","occurredAt":"2026-08-11T20:00:00Z","payload":{"paymentId":"62000000-0000-4000-8000-000000000001","orderId":"65000000-0000-4000-8000-000000000001","amount":199.80,"currency":"SEK","providerReference":"sim_cap_12345678","completedAt":"2026-08-11T20:00:00Z"}}
